{
  "$schema": "https://json-schema.org/draft/2020-12/schema",
  "$id": "https://smart-ward-hub.invalid/schemas/wave4-independent-review-package-v1",
  "title": "Smart Ward Hub Wave 4 Independent Review Package",
  "type": "object",
  "additionalProperties": false,
  "required": [
    "schema_version",
    "project",
    "package_id",
    "source_revision",
    "freeze_manifest_sha256",
    "package_state",
    "evidence_class",
    "wave_e_bundle_state",
    "independent_review_status",
    "external_owner_appointment",
    "mapping",
    "artifacts",
    "review_contract",
    "authorization_boundary",
    "independent_verification_required",
    "redaction",
    "raw_identity_present"
  ],
  "properties": {
    "schema_version": {
      "const": "wave4-independent-review-package-v1"
    },
    "project": {
      "const": "smart-ward-hub"
    },
    "package_id": {
      "type": "string"
    },
    "source_revision": {
      "type": "string"
    },
    "freeze_manifest_sha256": {
      "const": "TOP_LEVEL_RELEASE_FREEZE"
    },
    "package_state": {
      "const": "READY_FOR_EXTERNAL_OWNER_APPOINTMENT"
    },
    "evidence_class": {
      "const": "SOFTWARE_COORDINATION_ONLY"
    },
    "wave_e_bundle_state": {
      "const": "NOT_EXECUTED"
    },
    "independent_review_status": {
      "const": "NOT_STARTED"
    },
    "external_owner_appointment": {
      "const": "PENDING_EXTERNAL_APPOINTMENT"
    },
    "mapping": {
      "type": "array",
      "minItems": 12,
      "maxItems": 12,
      "items": {
        "type": "object",
        "additionalProperties": false,
        "required": [
          "test_case_id",
          "focus",
          "evidence_class",
          "local_artifact_refs",
          "external_verification_status",
          "reviewer_action"
        ],
        "properties": {
          "test_case_id": {
            "type": "string",
            "pattern": "^T-(0[1-9]|1[0-2])$"
          },
          "focus": {
            "type": "string"
          },
          "evidence_class": {
            "type": "string"
          },
          "local_artifact_refs": {
            "type": "array",
            "minItems": 1,
            "items": {
              "type": "string"
            }
          },
          "external_verification_status": {
            "const": "PENDING_EXTERNAL"
          },
          "reviewer_action": {
            "type": "string"
          }
        }
      }
    },
    "artifacts": {
      "type": "array",
      "minItems": 22,
      "maxItems": 22,
      "items": {
        "type": "object",
        "additionalProperties": false,
        "required": [
          "artifact_ref",
          "repo_path",
          "artifact_type",
          "artifact_sha256",
          "source_revision",
          "evidence_class",
          "prepared_by_role",
          "redaction",
          "raw_identity_present",
          "external_verification_status"
        ],
        "properties": {
          "artifact_ref": {
            "type": "string"
          },
          "repo_path": {
            "type": "string"
          },
          "artifact_type": {
            "type": "string"
          },
          "artifact_sha256": {
            "type": "string",
            "pattern": "^[a-f0-9]{64}$"
          },
          "source_revision": {
            "type": "string"
          },
          "evidence_class": {
            "const": "SOFTWARE_REPOSITORY"
          },
          "prepared_by_role": {
            "const": "evidence_custodian"
          },
          "redaction": {
            "const": "PASS"
          },
          "raw_identity_present": {
            "const": false
          },
          "external_verification_status": {
            "const": "PENDING_EXTERNAL"
          }
        }
      }
    },
    "review_contract": {
      "const": "wave-e-evidence-bundle-v1"
    },
    "authorization_boundary": {
      "type": "object",
      "additionalProperties": false,
      "required": [
        "external_authority",
        "clinical_validation_authorized",
        "production_authorized",
        "runtime_authority",
        "pilot_gate_status"
      ],
      "properties": {
        "external_authority": {
          "const": "NONE"
        },
        "clinical_validation_authorized": {
          "const": false
        },
        "production_authorized": {
          "const": false
        },
        "runtime_authority": {
          "const": "NONE"
        },
        "pilot_gate_status": {
          "const": "BLOCKED_PENDING_EXTERNAL_AUTHORIZATION"
        }
      }
    },
    "independent_verification_required": {
      "const": true
    },
    "redaction": {
      "const": "PASS"
    },
    "raw_identity_present": {
      "const": false
    }
  }
}
