{
  "schema_version": "wave4-independent-review-package-v1",
  "project": "smart-ward-hub",
  "package_id": "wave4-index-899e9423412a",
  "source_revision": "899e9423412ac91276340b0e13cf0998ec10aec7",
  "freeze_manifest_sha256": "TOP_LEVEL_RELEASE_FREEZE",
  "package_state": "READY_FOR_EXTERNAL_OWNER_APPOINTMENT",
  "evidence_class": "SOFTWARE_COORDINATION_ONLY",
  "wave_e_bundle_state": "NOT_EXECUTED",
  "independent_review_status": "NOT_STARTED",
  "external_owner_appointment": "PENDING_EXTERNAL_APPOINTMENT",
  "mapping": [
    {
      "test_case_id": "T-01",
      "focus": "Approved endpoint identity",
      "evidence_class": "SOFTWARE_PREPARATION_ONLY",
      "local_artifact_refs": [
        "wave1-foundation-report",
        "wave1-software-preparation"
      ],
      "external_verification_status": "PENDING_EXTERNAL",
      "reviewer_action": "Independent reviewer must verify hash, source revision, scope, expiry, role separation and external evidence before any decision."
    },
    {
      "test_case_id": "T-02",
      "focus": "OIDC issuer audience and JWKS",
      "evidence_class": "SOFTWARE_PREPARATION_ONLY",
      "local_artifact_refs": [
        "wave1-foundation-report",
        "wave1-identity-transport-template"
      ],
      "external_verification_status": "PENDING_EXTERNAL",
      "reviewer_action": "Independent reviewer must verify hash, source revision, scope, expiry, role separation and external evidence before any decision."
    },
    {
      "test_case_id": "T-03",
      "focus": "mTLS lifecycle",
      "evidence_class": "SOFTWARE_SIMULATION_ONLY",
      "local_artifact_refs": [
        "p0-mtls-tests",
        "wave1-technical-validation"
      ],
      "external_verification_status": "PENDING_EXTERNAL",
      "reviewer_action": "Independent reviewer must verify hash, source revision, scope, expiry, role separation and external evidence before any decision."
    },
    {
      "test_case_id": "T-04",
      "focus": "ACL and segmentation",
      "evidence_class": "SOFTWARE_PREPARATION_ONLY",
      "local_artifact_refs": [
        "p1-002-host-report",
        "p1-host-checklist"
      ],
      "external_verification_status": "PENDING_EXTERNAL",
      "reviewer_action": "Independent reviewer must verify hash, source revision, scope, expiry, role separation and external evidence before any decision."
    },
    {
      "test_case_id": "T-05",
      "focus": "Contract and version negotiation",
      "evidence_class": "SOFTWARE_VERIFIED_SIMULATION_ONLY",
      "local_artifact_refs": [
        "wave-e-contract",
        "wave-e-tests"
      ],
      "external_verification_status": "PENDING_EXTERNAL",
      "reviewer_action": "Independent reviewer must verify hash, source revision, scope, expiry, role separation and external evidence before any decision."
    },
    {
      "test_case_id": "T-06",
      "focus": "Freeze scope and governance binding",
      "evidence_class": "SOFTWARE_COORDINATION_ONLY",
      "local_artifact_refs": [
        "wave0-governance-checklist",
        "wave3-readiness-report",
        "wave-e-contract"
      ],
      "external_verification_status": "PENDING_EXTERNAL",
      "reviewer_action": "Independent reviewer must verify hash, source revision, scope, expiry, role separation and external evidence before any decision."
    },
    {
      "test_case_id": "T-07",
      "focus": "Idempotency and uncertain commit",
      "evidence_class": "SOFTWARE_VERIFIED_SIMULATION_ONLY",
      "local_artifact_refs": [
        "external-auth-simulator",
        "wave-e-contract"
      ],
      "external_verification_status": "PENDING_EXTERNAL",
      "reviewer_action": "Independent reviewer must verify hash, source revision, scope, expiry, role separation and external evidence before any decision."
    },
    {
      "test_case_id": "T-08",
      "focus": "Expiry and revocation",
      "evidence_class": "SOFTWARE_PREPARATION_ONLY",
      "local_artifact_refs": [
        "p1-003-key-custody-report",
        "p1-004-anchor-report"
      ],
      "external_verification_status": "PENDING_EXTERNAL",
      "reviewer_action": "Independent reviewer must verify hash, source revision, scope, expiry, role separation and external evidence before any decision."
    },
    {
      "test_case_id": "T-09",
      "focus": "Response authenticity",
      "evidence_class": "SOFTWARE_SIMULATION_ONLY",
      "local_artifact_refs": [
        "wave2-forensic-report",
        "external-anchor-runtime"
      ],
      "external_verification_status": "PENDING_EXTERNAL",
      "reviewer_action": "Independent reviewer must verify hash, source revision, scope, expiry, role separation and external evidence before any decision."
    },
    {
      "test_case_id": "T-10",
      "focus": "Audit and custody",
      "evidence_class": "SOFTWARE_VERIFIED_LOCAL_ONLY",
      "local_artifact_refs": [
        "backup-restore-contract",
        "p1-001-backup-report",
        "file-anchor-store"
      ],
      "external_verification_status": "PENDING_EXTERNAL",
      "reviewer_action": "Independent reviewer must verify hash, source revision, scope, expiry, role separation and external evidence before any decision."
    },
    {
      "test_case_id": "T-11",
      "focus": "Retry and rate limiting",
      "evidence_class": "SOFTWARE_SIMULATION_ONLY",
      "local_artifact_refs": [
        "network-pressure-plan",
        "external-auth-simulator"
      ],
      "external_verification_status": "PENDING_EXTERNAL",
      "reviewer_action": "Independent reviewer must verify hash, source revision, scope, expiry, role separation and external evidence before any decision."
    },
    {
      "test_case_id": "T-12",
      "focus": "Stop and recovery",
      "evidence_class": "SOFTWARE_COORDINATION_ONLY",
      "local_artifact_refs": [
        "p1-008-review-report",
        "wave3-readiness-report",
        "controlled-pilot-gate"
      ],
      "external_verification_status": "PENDING_EXTERNAL",
      "reviewer_action": "Independent reviewer must verify hash, source revision, scope, expiry, role separation and external evidence before any decision."
    }
  ],
  "artifacts": [
    {
      "artifact_ref": "wave1-foundation-report",
      "repo_path": "WAVE_1_TECHNICAL_FOUNDATION_READINESS_REPORT_20260821.md",
      "artifact_type": "md",
      "artifact_sha256": "3a43bf499d14a88f3e57932e276da0cb6a156d39b4596787ce08ec01e3b03344",
      "source_revision": "899e9423412ac91276340b0e13cf0998ec10aec7",
      "evidence_class": "SOFTWARE_REPOSITORY",
      "prepared_by_role": "evidence_custodian",
      "redaction": "PASS",
      "raw_identity_present": false,
      "external_verification_status": "PENDING_EXTERNAL"
    },
    {
      "artifact_ref": "wave1-software-preparation",
      "repo_path": "wave1_software_preparation.py",
      "artifact_type": "py",
      "artifact_sha256": "fa43949ef9192a67cc3cace5b526fa41ffbe2dbdb7ac1b298e8416a3911430b9",
      "source_revision": "899e9423412ac91276340b0e13cf0998ec10aec7",
      "evidence_class": "SOFTWARE_REPOSITORY",
      "prepared_by_role": "evidence_custodian",
      "redaction": "PASS",
      "raw_identity_present": false,
      "external_verification_status": "PENDING_EXTERNAL"
    },
    {
      "artifact_ref": "wave1-identity-transport-template",
      "repo_path": "WAVE_1_IDENTITY_TRANSPORT_CONFIG_TEMPLATE.env.example",
      "artifact_type": "example",
      "artifact_sha256": "8330e6e328a74b616befea6904cbbce901d9d9817572eb9e5bdc02d417487a10",
      "source_revision": "899e9423412ac91276340b0e13cf0998ec10aec7",
      "evidence_class": "SOFTWARE_REPOSITORY",
      "prepared_by_role": "evidence_custodian",
      "redaction": "PASS",
      "raw_identity_present": false,
      "external_verification_status": "PENDING_EXTERNAL"
    },
    {
      "artifact_ref": "p0-mtls-tests",
      "repo_path": "test_p0_mtls_config.py",
      "artifact_type": "py",
      "artifact_sha256": "d531cf50cff1366bf82e0cc5c3b331356c7e53ab0846e8b1018fc1958c281a14",
      "source_revision": "899e9423412ac91276340b0e13cf0998ec10aec7",
      "evidence_class": "SOFTWARE_REPOSITORY",
      "prepared_by_role": "evidence_custodian",
      "redaction": "PASS",
      "raw_identity_present": false,
      "external_verification_status": "PENDING_EXTERNAL"
    },
    {
      "artifact_ref": "wave1-technical-validation",
      "repo_path": "WAVE_1_TECHNICAL_VALIDATION_PACKAGE_20260820.md",
      "artifact_type": "md",
      "artifact_sha256": "cc915d23c5ae286dcae478ccbf22bf4b1c05795229c731280ca3c4bc3be43cb9",
      "source_revision": "899e9423412ac91276340b0e13cf0998ec10aec7",
      "evidence_class": "SOFTWARE_REPOSITORY",
      "prepared_by_role": "evidence_custodian",
      "redaction": "PASS",
      "raw_identity_present": false,
      "external_verification_status": "PENDING_EXTERNAL"
    },
    {
      "artifact_ref": "p1-002-host-report",
      "repo_path": "P1_002_HOST_HARDENING_READINESS_REPORT.md",
      "artifact_type": "md",
      "artifact_sha256": "4dcbd4e86a68c05215ef77338c958a8b994b36ce14217ab32b7babba04b903d8",
      "source_revision": "899e9423412ac91276340b0e13cf0998ec10aec7",
      "evidence_class": "SOFTWARE_REPOSITORY",
      "prepared_by_role": "evidence_custodian",
      "redaction": "PASS",
      "raw_identity_present": false,
      "external_verification_status": "PENDING_EXTERNAL"
    },
    {
      "artifact_ref": "p1-host-checklist",
      "repo_path": "P1_HOST_HARDENING_CHECKLIST.md",
      "artifact_type": "md",
      "artifact_sha256": "1ab1a9a8a14b2d435d8ed3e0bf85cad1f66df95955c93888f73d10306b1ade74",
      "source_revision": "899e9423412ac91276340b0e13cf0998ec10aec7",
      "evidence_class": "SOFTWARE_REPOSITORY",
      "prepared_by_role": "evidence_custodian",
      "redaction": "PASS",
      "raw_identity_present": false,
      "external_verification_status": "PENDING_EXTERNAL"
    },
    {
      "artifact_ref": "wave-e-contract",